{
  "artifact": "REVIEW_RESULT",
  "schema_version": "fitflow-review-result/v2",
  "task_id": "FF-AI-VNEXT-001",
  "run_id": "FF-AI-VNEXT-001-20260818",
  "created_at": "2026-08-18T15:49:54-03:00",
  "baseline": {
    "revision": "3f3021b2cf26c5839feb428a50b59e1116f283a0",
    "fingerprint_status": "unavailable",
    "working_tree_fingerprint": null,
    "fingerprint_reason": "El arbol ya contenia cambios previos y no se capturo un fingerprint antes de iniciar la migracion."
  },
  "reviewer_role": "reviewer",
  "independent": true,
  "verdict": "PASS",
  "findings": [],
  "validation_ref": {
    "path": ".ai/runs/FF-AI-VNEXT-001-20260818/validation.json",
    "hash": "sha256:1ac8e550c05cf84a0d5cb9131cf1d6530f7f78dcc5a6d9c15403b68208813de0",
    "schema_version": "fitflow-validation-result/v2"
  },
  "summary": "PASS en tercera ronda; los 11 findings acumulados fueron corregidos. La enmienda operativa posterior conserva los contratos y registra OpenCode CLI, render DOCX y Copilot diferido.",
  "next_state": "DOC_SYNC"
}
